<?xml version="1.0" encoding="UTF-8"?>
<?xml-stylesheet type="text/xsl" href="transform.xsl"?>
<ev xmlns="http://xyz.com/ev"
    xmlns:xsi="http://www.w3.org/2001/XMLSchema-instance"
    xsi:schemaLocation="http://xyz.com/ev ev1.xsd">

    <vehicle>
        <model>Tesla Model S</model>
        <range>370</range>
        <battery_capacity>100</battery_capacity>
    </vehicle>

    <charging_station>
        <name>FastCharge Station</name>
        <location>123 Electric Ave, Silicon Valley, CA</location>
        <charger_type>DC Fast Charger</charger_type>
    </charging_station>

    <hotel>
        <name>EcoStay Hotel</name>
        <location>456 Green Blvd, Los Angeles, CA</location>
        <rating>4.5</rating>
    </hotel>

    <feedback>
        <comment>Great trip, but the charging station was a bit crowded.</comment>
        <rating>4</rating>
        <feedback_type>Travel Experience</feedback_type>
    </feedback>
</ev>
